{
  "$schema": "https://json-schema.org/draft/2020-12/schema",
  "title": "Commentate This commentary script",
  "type": "object",
  "additionalProperties": false,
  "properties": {
    "version": {"type": "string", "const": "1.0"},
    "title": {"type": "string", "minLength": 1, "maxLength": 100},
    "sourceText": {"type": "string", "minLength": 1, "maxLength": 500},
    "mode": {"type": "string", "enum": ["routine", "cup_final", "last_minute", "relegation", "excessive"]},
    "targetDurationSeconds": {"type": "integer", "minimum": 15, "maximum": 60},
    "segments": {
      "type": "array",
      "minItems": 4,
      "maxItems": 10,
      "items": {
        "type": "object",
        "additionalProperties": false,
        "properties": {
          "id": {"type": "string", "pattern": "^s[0-9]{2}$"},
          "speaker": {"type": "string", "enum": ["commentator", "analyst"]},
          "role": {"type": "string", "enum": ["set_up", "build", "obstacle", "escalation", "pause", "climax", "aftermath", "analysis"]},
          "text": {"type": "string", "minLength": 1, "maxLength": 280},
          "delivery": {
            "type": "object",
            "additionalProperties": false,
            "properties": {
              "intensity": {"type": "integer", "minimum": 0, "maximum": 5},
              "pace": {"type": "string", "enum": ["calm", "measured", "building", "fast", "breathless", "shout"]},
              "volume": {"type": "string", "enum": ["quiet", "normal", "loud", "full"]},
              "emotion": {"type": "string", "enum": ["matter_of_fact", "focused", "concerned", "urgent", "astonished", "triumphant", "disappointed"]},
              "pauseBeforeMs": {"type": "integer", "minimum": 0, "maximum": 2500},
              "pauseAfterMs": {"type": "integer", "minimum": 0, "maximum": 3000}
            },
            "required": ["intensity", "pace", "volume", "emotion", "pauseBeforeMs", "pauseAfterMs"]
          },
          "crowd": {
            "type": "object",
            "additionalProperties": false,
            "properties": {
              "bed": {"type": "string", "enum": ["silent", "low", "medium", "high"]},
              "reaction": {"type": "string", "enum": ["none", "murmur", "gasp", "groan", "roar", "boo", "applause"]},
              "ducking": {"type": "number", "minimum": 0, "maximum": 1}
            },
            "required": ["bed", "reaction", "ducking"]
          }
        },
        "required": ["id", "speaker", "role", "text", "delivery", "crowd"]
      }
    }
  },
  "required": ["version", "title", "sourceText", "mode", "targetDurationSeconds", "segments"]
}
